Domain,Title,Link
Bio,Machine learning for single-cell epigenomics,https://arxiv.org/search/?query=Machine+learning+for+single-cell+epigenomics&searchtype=title
Bio,Modeling RNA structure with deep learning,https://arxiv.org/search/?query=Modeling+RNA+structure+with+deep+learning&searchtype=title
Bio,Deep generative design of antibodies,https://arxiv.org/search/?query=Deep+generative+design+of+antibodies&searchtype=title
Bio,AI in computational pathology,https://arxiv.org/search/?query=AI+in+computational+pathology&searchtype=title
Bio,Machine learning for infectious disease outbreaks,https://arxiv.org/search/?query=Machine+learning+for+infectious+disease+outbreaks&searchtype=title
Bio,Deep learning of protein conformational ensembles,https://arxiv.org/search/?query=Deep+learning+of+protein+conformational+ensembles&searchtype=title
Bio,Language models for regulatory genomics,https://arxiv.org/search/?query=Language+models+for+regulatory+genomics&searchtype=title
Bio,Automated analysis of biological pathways using AI,https://arxiv.org/search/?query=Automated+analysis+of+biological+pathways+using+AI&searchtype=title
Bio,AI-driven optimization of synthetic biological circuits,https://arxiv.org/search/?query=AI-driven+optimization+of+synthetic+biological+circuits&searchtype=title
Bio,Machine learning for multi-omics biomarker discovery,https://arxiv.org/search/?query=Machine+learning+for+multi-omics+biomarker+discovery&searchtype=title
