Domain,Title,Link
CS,Faster R-CNN: Towards Real-Time Object Detection with Region Proposal Networks,https://arxiv.org/abs/1506.01497
CS,You Only Look Once: Unified Real-Time Object Detection,https://arxiv.org/abs/1506.02640
CS,SSD: Single Shot MultiBox Detector,https://arxiv.org/abs/1512.02325
CS,XGBoost: A Scalable Tree Boosting System,https://arxiv.org/abs/1603.02754
CS,Graph Convolutional Networks for Semi-Supervised Classification,https://arxiv.org/abs/1609.02907
CS,Graph Attention Networks,https://arxiv.org/abs/1710.10903
CS,Inductive Representation Learning on Large Graphs,https://arxiv.org/abs/1706.02216
CS,Semi-Supervised Classification with Graph Convolutional Networks,https://arxiv.org/abs/1609.02907
CS,Deep Reinforcement Learning with Double Q-learning,https://arxiv.org/abs/1509.06461
CS,Continuous control with deep reinforcement learning,https://arxiv.org/abs/1509.02971
