Domain,Title,Link
Physics,The Accelerating Universe and Dark Energy,https://arxiv.org/abs/astro-ph/9812133
Physics,The Cosmological Constant Problem,https://arxiv.org/abs/astro-ph/0603057
Physics,Quintessence and Dark Energy,https://arxiv.org/search/?query=Quintessence+and+Dark+Energy&searchtype=title
Physics,Modified Gravity Theories,https://arxiv.org/search/?query=Modified+Gravity+Theories&searchtype=title
Physics,f(R) Gravity,https://arxiv.org/abs/0805.1726
Physics,Gravitational Waves from Binary Black Holes,https://arxiv.org/abs/1602.03837
Physics,Gravitational Waves from Binary Neutron Stars,https://arxiv.org/abs/1710.05832
Physics,Multi-Messenger Astronomy with Gravitational Waves,https://arxiv.org/abs/1710.05833
Physics,The Stochastic Gravitational Wave Background,https://arxiv.org/search/?query=The+Stochastic+Gravitational+Wave+Background&searchtype=title
Physics,Pulsar Timing Arrays and Gravitational Waves,https://arxiv.org/abs/2306.16213
