Domain,Title,Link
Bio,Interpretable deep learning in biosciences,https://arxiv.org/search/?query=Interpretable+deep+learning+in+biosciences&searchtype=title
Bio,Predicting post-translational modifications,https://arxiv.org/search/?query=Predicting+post-translational+modifications&searchtype=title
Bio,Machine learning analysis of microbiome interactions,https://arxiv.org/search/?query=Machine+learning+analysis+of+microbiome+interactions&searchtype=title
Bio,Sequence-based prediction of protein aggregation,https://arxiv.org/search/?query=Sequence-based+prediction+of+protein+aggregation&searchtype=title
Bio,AI for automated experimental biology,https://arxiv.org/search/?query=AI+for+automated+experimental+biology&searchtype=title
Bio,AI synthesis of biomedical research hypotheses,https://arxiv.org/search/?query=AI+synthesis+of+biomedical+research+hypotheses&searchtype=title
Bio,Deep learning of RNA-protein interactions,https://arxiv.org/search/?query=Deep+learning+of+RNA-protein+interactions&searchtype=title
Bio,Network analysis of disease modules with graph models,https://arxiv.org/search/?query=Network+analysis+of+disease+modules+with+graph+models&searchtype=title
Bio,AI-driven systems medicine,https://arxiv.org/search/?query=AI-driven+systems+medicine&searchtype=title
Bio,Deep models of epigenetic regulation,https://arxiv.org/search/?query=Deep+models+of+epigenetic+regulation&searchtype=title
