Domain,Title,Link
Math,Induced subgraphs of hypercubes and a proof of the Sensitivity Conjecture,https://arxiv.org/abs/1907.00847
Math,A proof of the invariant subspace problem for Banach spaces,https://arxiv.org/search/?query=invariant+subspace+problem+for+banach+spaces&searchtype=title
Math,Fractional intersections of theorems and bounds,https://arxiv.org/search/?query=fractional+intersections+of+theorems+and+bounds&searchtype=title
Math,On the Twin Prime Conjecture,https://arxiv.org/search/?query=Twin+Prime+Conjecture&searchtype=title
Math,Bounded gaps between primes,https://arxiv.org/search/?query=Bounded+gaps+between+primes&searchtype=title
Math,New bounds for the zeros of the Riemann zeta function,https://arxiv.org/search/?query=New+bounds+for+the+zeros+of+the+Riemann+zeta+function&searchtype=title
Math,A new proof of the existence of invariants,https://arxiv.org/search/?query=A+new+proof+of+the+existence+of+invariants&searchtype=title
Math,The resolution of singularity for algebraic varieties over fields of characteristic zero,https://arxiv.org/abs/math/9804127
Math,On the local Langlands conjecture for GL(n) over a p-adic local field,https://arxiv.org/abs/math/9903113
Math,The modularity of elliptic curves over Q,https://arxiv.org/abs/math/9911068
