Domain,Title,Link
Bio,Long-term potentiation and memory formation,https://arxiv.org/search/?query=Long-term+potentiation+memory+formation&searchtype=title
Bio,Mechanisms of sensory transduction,https://arxiv.org/search/?query=Mechanisms+sensory+transduction&searchtype=title
Bio,Motor control pathways in the central nervous system,https://arxiv.org/search/?query=Motor+control+pathways+central+nervous+system&searchtype=title
Bio,Autonomic nervous system regulation,https://arxiv.org/search/?query=Autonomic+nervous+system+regulation&searchtype=title
Bio,Neuroendocrine regulation and hormone action,https://arxiv.org/search/?query=Neuroendocrine+regulation+hormone+action&searchtype=title
Bio,Mechanisms of circadian rhythms and sleep,https://arxiv.org/search/?query=Mechanisms+circadian+rhythms+sleep&searchtype=title
Bio,Pathophysiology of neurodegenerative diseases,https://arxiv.org/search/?query=Pathophysiology+neurodegenerative+diseases&searchtype=title
Bio,Mechanisms of psychiatric disorders,https://arxiv.org/search/?query=Mechanisms+psychiatric+disorders&searchtype=title
Bio,Cardiovascular system regulation and function,https://arxiv.org/search/?query=Cardiovascular+system+regulation+function&searchtype=title
Bio,Respiratory mechanics and gas exchange,https://arxiv.org/search/?query=Respiratory+mechanics+gas+exchange&searchtype=title
