Domain,Title,Link
Physics,Lovelock Gravity and Higher Derivative Theories,https://arxiv.org/search/?query=Lovelock+Gravity&searchtype=title
Physics,Horava-Lifshitz Gravity,https://arxiv.org/abs/0901.3775
Physics,Massive Gravity Theory,https://arxiv.org/abs/1007.0443
Physics,Ghost-free Massive Gravity,https://arxiv.org/abs/1011.1232
Physics,Galileons and the Vainshtein Mechanism,https://arxiv.org/abs/0811.2197
Physics,DGP Braneworld Cosmology,https://arxiv.org/abs/hep-th/0005016
Physics,String Gas Cosmology,https://arxiv.org/abs/hep-th/8904033
Physics,Loop Quantum Cosmology,https://arxiv.org/abs/gr-qc/0601085
Physics,Observation of B-mode Polarization from the SPT,https://arxiv.org/abs/1307.5830
Physics,Quantum Spin Liquids in Kagome Lattices,https://arxiv.org/abs/cond-mat/0612446
Physics,Kitaev Model and Anyons on a Torus,https://arxiv.org/abs/cond-mat/0506438
Physics,Topological Quantum Computation with Non-Abelian Anyons,https://arxiv.org/abs/quant-ph/0205206
Physics,Majorana Fermions in Condensed Matter,https://arxiv.org/abs/1206.1736
Physics,Evidence for Majorana Bound States in Nanowires,https://arxiv.org/abs/1204.2792
Physics,Observation of Weyl Fermions in a Semimetal,https://arxiv.org/abs/1502.04684
Physics,Prediction and Observation of a Type-II Weyl Semimetal,https://arxiv.org/abs/1506.06577
Physics,Twistronics and Magic-Angle Graphene,https://arxiv.org/abs/1803.02342
Physics,Superconductivity in Magic-Angle Bilayer Graphene,https://arxiv.org/abs/1803.02342
Physics,Mott Insulator State in Magic-Angle Graphene,https://arxiv.org/abs/1803.02343
Physics,Observation of Time Crystals,https://arxiv.org/abs/1610.08057
Physics,Discrete Time Crystals: Rigidity, Criticality, and Realizations,https://arxiv.org/abs/1608.02589
Physics,Quantum Many-Body Scrambling and OTOCs,https://arxiv.org/abs/1503.01409
Physics,Experimental Measurement of Out-of-Time-Ordered Correlators,https://arxiv.org/abs/1612.05249
Physics,MBL: Many-Body Localization Phase Transition,https://arxiv.org/abs/1404.0686
Physics,Thermalization and its absence in isolated quantum systems,https://arxiv.org/abs/1404.0686
Physics,Eigenstate Thermalization Hypothesis (ETH),https://arxiv.org/abs/cond-mat/9403051
Physics,Quantum Information Scrambling in Ion Traps,https://arxiv.org/abs/1806.01256
Physics,Boson Sampling with Photons,https://arxiv.org/abs/1011.3245
Physics,Experimental Boson Sampling using integrated photonics,https://arxiv.org/abs/1212.0622
Physics,Quantum Supremacy via Boson Sampling,https://arxiv.org/abs/2012.01625
Physics,Photonic Quantum Computer for solving large linear systems,https://arxiv.org/abs/1302.1946
Physics,Quantum Algorithm for Solving Linear Systems of Equations (HHL),https://arxiv.org/abs/0811.3171
Physics,Variational Quantum Eigensolver (VQE),https://arxiv.org/abs/1304.3061
Physics,Quantum Approximate Optimization Algorithm (QAOA),https://arxiv.org/abs/1411.4028
Physics,Hardware-efficient variational quantum eigensolver,https://arxiv.org/abs/1704.05018
Physics,Demonstration of topological data analysis on a quantum processor,https://arxiv.org/abs/1408.3129
Physics,Surface Code Quantum Error Correction,https://arxiv.org/abs/1208.0928
Physics,Realizing Repeated Quantum Error Correction in a Distance-Three Surface Code,https://arxiv.org/abs/2102.06132
Physics,Suppression of Quantum Errors by Scaling a Surface Code Logical Qubit,https://arxiv.org/abs/2207.06431
Physics,Measurement-Device-Independent Quantum Key Distribution,https://arxiv.org/abs/1112.0525
Physics,Micius Satellite: Satellite-Based Quantum Key Distribution,https://arxiv.org/abs/1707.00542
Physics,Entanglement distribution over 1200 kilometers from a satellite,https://arxiv.org/abs/1707.01339
Physics,Observation of CP Violation in the B Meson System,https://arxiv.org/abs/hep-ex/0107013
Physics,Discovery of the pentaquark states Pc(4380)+ and Pc(4450)+,https://arxiv.org/abs/1507.03414
Physics,Observation of doubly charmed baryon Xi_cc++,https://arxiv.org/abs/1707.01621
Physics,Measurement of the anomalous magnetic moment of the muon (g-2),https://arxiv.org/abs/2104.03281
Physics,First Results from the Muon g-2 Experiment at Fermilab,https://arxiv.org/abs/2104.03281
Physics,Measurement of the W boson mass at CDF,https://arxiv.org/abs/2204.04705
Physics,Test of Lepton Universality in b decays,https://arxiv.org/abs/1406.6482
Physics,Observation of a new state around 3872 MeV (X(3872)),https://arxiv.org/abs/hep-ex/0309032
Physics,The ALFA results on the total cross-section of pp collisions,https://arxiv.org/search/?query=ALFA+results+cross-section+pp+collisions&searchtype=title
Physics,Observation of the Bottomonium Ground State in Upsilon Decays,https://arxiv.org/search/?query=Bottomonium+Ground+State+Upsilon+Decays&searchtype=title
Physics,Direct limit on the speed of light from gravitational waves,https://arxiv.org/abs/1710.05834
Physics,Constraining the speed of gravity with GW170817,https://arxiv.org/abs/1710.05834
Physics,Limits on axion dark matter from ADMX,https://arxiv.org/abs/1804.05750
Physics,Results from the XENON1T Dark Matter Experiment,https://arxiv.org/abs/1805.12562
Physics,Direct detection constraints on light dark matter,https://arxiv.org/search/?query=Direct+detection+constraints+on+light+dark+matter&searchtype=title
Physics,Cosmic Dawn signal and the 21-cm global spectrum,https://arxiv.org/abs/1802.10094
Physics,CHIME Fast Radio Bursts catalog 1,https://arxiv.org/abs/2106.04352
Physics,Localization of a fast radio burst to a host galaxy,https://arxiv.org/abs/1701.01098
Physics,Detection of a fast radio burst from a Galactic magnetar,https://arxiv.org/abs/2005.10828
Physics,The DES Y3 cosmological constraints,https://arxiv.org/abs/2105.13549
Physics,Tension in the Hubble Constant: Is New Physics Required?,https://arxiv.org/abs/1908.03663
Bio,Unsupervised learning of evolutionary landscapes for drug discovery,https://arxiv.org/abs/2101.08331
Bio,Deep learning on graphs for bioinformatics,https://arxiv.org/search/?query=Deep+learning+on+graphs+for+bioinformatics&searchtype=title
Bio,Geometric Deep Learning for structural bioinformatics,https://arxiv.org/search/?query=Geometric+Deep+Learning+for+structural+bioinformatics&searchtype=title
Bio,Learning the protein language: Evolution sequence and structure,https://arxiv.org/search/?query=Learning+the+protein+language+Evolution+sequence+and+structure&searchtype=title
Bio,Unified language models for biological sequence generation,https://arxiv.org/search/?query=Unified+language+models+biological+sequence+generation&searchtype=title
Bio,A foundation model for generalizable disease prediction,https://arxiv.org/abs/2301.07681
Bio,Pre-training of graph neural networks for molecules,https://arxiv.org/abs/1905.12265
Bio,Self-supervised graph learning for drug discovery,https://arxiv.org/search/?query=Self-supervised+graph+learning+for+drug+discovery&searchtype=title
Bio,Molecular graph generation via auto-regressive networks,https://arxiv.org/abs/1802.04364
Bio,Junction Tree Variational Autoencoder for Molecular Graph Generation,https://arxiv.org/abs/1802.04364
Bio,Deep drug repurposing using graph autoencoders,https://arxiv.org/search/?query=Deep+drug+repurposing+graph+autoencoders&searchtype=title
Bio,Translating brain activity directly into speech,https://arxiv.org/search/?query=Translating+brain+activity+into+speech&searchtype=title
Bio,Neural decoding using large language models,https://arxiv.org/abs/2305.00696
Bio,Semantic reconstruction of continuous language from brain recordings,https://arxiv.org/search/?query=Semantic+reconstruction+continuous+language+from+brain+recordings&searchtype=title
Bio,High-performance brain-to-text communication via handwriting,https://arxiv.org/search/?query=High-performance+brain-to-text+communication+via+handwriting&searchtype=title
Bio,Causal mapping of the human brain connectome,https://arxiv.org/search/?query=Causal+mapping+of+the+human+brain+connectome&searchtype=title
Bio,Generative models of single-cell transcriptomes,https://arxiv.org/abs/1812.01206
Bio,scVI: Deep generative modeling for single-cell transcriptomics,https://arxiv.org/abs/1709.02082
Bio,Transfer learning in single-cell transcriptomics,https://arxiv.org/abs/1910.01791
Bio,Spatially resolved transcriptomics prediction using graph attention,https://arxiv.org/search/?query=Spatially+resolved+transcriptomics+prediction+graph&searchtype=title
Bio,Multi-omics data integration using deep learning,https://arxiv.org/search/?query=Multi-omics+data+integration+deep+learning&searchtype=title
Bio,Predicting gene regulatory networks from single-cell data,https://arxiv.org/search/?query=Predicting+gene+regulatory+networks+from+single-cell+data&searchtype=title
Bio,De novo prediction of RNA-binding proteins,https://arxiv.org/search/?query=De+novo+prediction+of+RNA-binding+proteins&searchtype=title
Bio,Structure-based virtual screening with deep learning,https://arxiv.org/search/?query=Structure-based+virtual+screening+deep+learning&searchtype=title
Bio,Equivariant 3D protein structure generation,https://arxiv.org/abs/2205.00880
Bio,Diffusion models for protein sequence to structure generation,https://arxiv.org/search/?query=Diffusion+models+for+protein+sequence+to+structure+generation&searchtype=title
Bio,Antigen-specific antibody design via deep generative models,https://arxiv.org/abs/2207.08779
Bio,Predicting the effects of all missense variants with deep learning,https://arxiv.org/abs/2309.03577
Bio,Deep mutagenesis prediction via language modeling,https://arxiv.org/abs/2101.07926
Bio,Protein function prediction using graph neural networks,https://arxiv.org/abs/2006.02299
Bio,Deep learning for cryo-EM map resolution enhancement,https://arxiv.org/abs/2004.09556
Bio,Atomic-level cryo-EM maps reconstruction via deep neural networks,https://arxiv.org/search/?query=cryo-EM+maps+reconstruction+neural+networks&searchtype=title
Bio,Deep learning driven de novo drug design,https://arxiv.org/search/?query=Deep+learning+driven+de+novo+drug+design&searchtype=title
Bio,Predicting off-target effects of CRISPR-Cas9 via deep learning,https://arxiv.org/abs/1806.00224
Bio,Deep learning reveals the language of cancer,https://arxiv.org/search/?query=Deep+learning+reveals+language+of+cancer&searchtype=title
Bio,Machine learning on tumor mutational burden,https://arxiv.org/search/?query=Machine+learning+on+tumor+mutational+burden&searchtype=title
Bio,Predicting immunotherapy response with deep learning,https://arxiv.org/search/?query=Predicting+immunotherapy+response+with+deep+learning&searchtype=title
Bio,Deep learning models for medical image segmentation,https://arxiv.org/abs/1505.04597
Bio,Unsupervised anomaly detection in medical imaging,https://arxiv.org/search/?query=Unsupervised+anomaly+detection+in+medical+imaging&searchtype=title
Bio,Generative models for synthesizing medical imaging data,https://arxiv.org/search/?query=Generative+models+synthesizing+medical+imaging+data&searchtype=title
Bio,Federated learning for multi-center healthcare data,https://arxiv.org/abs/2108.08398
Bio,Self-supervised contrastive learning for medical time series,https://arxiv.org/abs/2109.11051
Bio,Attention mechanisms in clinical natural language processing,https://arxiv.org/search/?query=Attention+mechanisms+clinical+NLP&searchtype=title
Bio,Clinical BERT representations for biomedical text mining,https://arxiv.org/abs/1904.05342
Bio,BioBERT: a pre-trained biomedical language representation model,https://arxiv.org/abs/1901.08746
Bio,PubMedBERT: Domain-Specific Language Model Pretraining for Biomedical Natural Language Processing,https://arxiv.org/abs/2007.15779
Bio,Transformers for extracting chemical-protein relations,https://arxiv.org/search/?query=Transformers+for+extracting+chemical-protein+relations&searchtype=title
Bio,Knowledge graph embeddings for drug-target interaction,https://arxiv.org/abs/2005.02331
Bio,Predicting synergistic drug combinations via deep learning,https://arxiv.org/search/?query=Predicting+synergistic+drug+combinations+deep+learning&searchtype=title
Bio,End-to-end learning to predict drug interactions,https://arxiv.org/search/?query=End-to-end+learning+predict+drug+interactions&searchtype=title
Bio,Machine learning for predicting clinical trial outcomes,https://arxiv.org/search/?query=Machine+learning+predicting+clinical+trial+outcomes&searchtype=title
Bio,Deep generative models for therapeutic antibody design,https://arxiv.org/search/?query=Deep+generative+models+therapeutic+antibody+design&searchtype=title
Bio,A unified approach for single-cell and spatial transcriptomics,https://arxiv.org/search/?query=unified+approach+single-cell+spatial+transcriptomics&searchtype=title
Bio,Spatial genomics via multiplexed FISH,https://arxiv.org/search/?query=Spatial+genomics+multiplexed+FISH&searchtype=title
Bio,Deep learning maps epigenetic modifications,https://arxiv.org/search/?query=Deep+learning+maps+epigenetic+modifications&searchtype=title
Bio,AlphaFold accelerates structural biology research,https://arxiv.org/abs/2202.13414
Bio,Machine learning prediction of antimicrobial resistance,https://arxiv.org/search/?query=Machine+learning+prediction+of+antimicrobial+resistance&searchtype=title
Bio,Deep sequence clustering reveals novel protein families,https://arxiv.org/search/?query=Deep+sequence+clustering+reveals+novel+protein+families&searchtype=title
Bio,Using deep networks to decode protein interaction rules,https://arxiv.org/search/?query=Using+deep+networks+to+decode+protein+interaction+rules&searchtype=title
Bio,Deep learning characterizes viral evolution architectures,https://arxiv.org/search/?query=Deep+learning+characterizes+viral+evolution+architectures&searchtype=title
Bio,Language models escape viral immune systems,https://arxiv.org/abs/2103.01138
CS,ResNet-152: Deep Residual Learning,https://arxiv.org/abs/1512.03385
CS,ResNet-50: Deep Residual Learning,https://arxiv.org/abs/1512.03385
CS,Scaling Laws for Neural Language Models,https://arxiv.org/abs/2001.08361
CS,Generative Agents Architecture,https://arxiv.org/abs/2304.03442
Math,The Millennium Prize Problems,https://arxiv.org/search/?query=The+Millennium+Prize+Problems&searchtype=title
Math,A Proof of the Poincare Conjecture,https://arxiv.org/abs/math/0307245
Math,The Birch and Swinnerton-Dyer Conjecture for Elliptic Curves over Q,https://arxiv.org/search/?query=The+Birch+and+Swinnerton-Dyer+Conjecture+for+Elliptic+Curves+over+Q&searchtype=title
Math,Faltings Theorem,https://arxiv.org/search/?query=Faltings+Theorem&searchtype=title
Math,The Mordell Conjecture,https://arxiv.org/search/?query=The+Mordell+Conjecture&searchtype=title
Math,Wiles' Proof of Fermat's Last Theorem,https://arxiv.org/search/?query=Proof+of+Fermat+Last+Theorem&searchtype=title
Math,The Modularity Theorem,https://arxiv.org/search/?query=The+Modularity+Theorem&searchtype=title
Math,The Weil Conjectures for Abelian Varieties,https://arxiv.org/search/?query=The+Weil+Conjectures+for+Abelian+Varieties&searchtype=title
Math,K-Theory and the Atiyah-Singer Index Theorem,https://arxiv.org/search/?query=K-Theory+and+the+Atiyah-Singer+Index+Theorem&searchtype=title
Math,Seiberg-Witten Invariants of Four-Manifolds,https://arxiv.org/search/?query=Seiberg-Witten+Invariants+of+Four-Manifolds&searchtype=title
Math,The Donaldson Invariants of Four-Manifolds,https://arxiv.org/search/?query=The+Donaldson+Invariants+of+Four-Manifolds&searchtype=title
Math,Floer Homology and Symplectic Topology,https://arxiv.org/search/?query=Floer+Homology+and+Symplectic+Topology&searchtype=title
Math,Khovanov Homology and the Jones Polynomial,https://arxiv.org/abs/math/9908171
Math,Kategorification of knot polynomials,https://arxiv.org/search/?query=Kategorification+of+knot+polynomials&searchtype=title
Math,The Volume Conjecture for knots,https://arxiv.org/search/?query=The+Volume+Conjecture+for+knots&searchtype=title
Math,The AJ Conjecture for knots,https://arxiv.org/search/?query=The+AJ+Conjecture+for+knots&searchtype=title
Math,The Kashaev Invariant of knots,https://arxiv.org/search/?query=The+Kashaev+Invariant+of+knots&searchtype=title
Math,The Quantum Invariants of Knots and 3-Manifolds,https://arxiv.org/search/?query=The+Quantum+Invariants+of+Knots+and+3-Manifolds&searchtype=title
Math,Chern-Simons Theory and Topological Invariants,https://arxiv.org/search/?query=Chern-Simons+Theory+and+Topological+Invariants&searchtype=title
Math,The Witten-Reshetikhin-Turaev Invariants,https://arxiv.org/search/?query=Witten-Reshetikhin-Turaev+Invariants&searchtype=title
Math,The Geometrization Conjecture of Thurston,https://arxiv.org/search/?query=The+Geometrization+Conjecture+of+Thurston&searchtype=title
Math,Ricci Flow with Surgery on 3-Manifolds,https://arxiv.org/abs/math/0303109
Math,The Sphere Packing Problem in 8 Dimensions,https://arxiv.org/abs/1603.04246
Math,The Sphere Packing Problem in 24 Dimensions,https://arxiv.org/abs/1603.06518
Math,Universal Optimality of the Leech Lattice,https://arxiv.org/search/?query=Universal+Optimality+of+the+Leech+Lattice&searchtype=title
Math,The Erdos-Szekeres Theorem in Combinatorial Geometry,https://arxiv.org/search/?query=Erdos-Szekeres+Theorem+in+Combinatorial+Geometry&searchtype=title
Math,The Szemeredi Regularity Lemma,https://arxiv.org/search/?query=Szemeredi+Regularity+Lemma&searchtype=title
Math,Green-Tao Theorem on Primes in Arithmetic Progression,https://arxiv.org/search/?query=Green-Tao+Theorem+on+Primes+in+Arithmetic+Progression&searchtype=title
Math,The Twin Prime Conjecture,https://arxiv.org/search/?query=Twin+Prime+Conjecture&searchtype=title
Math,Yitang Zhang's Bound on Prime Gaps,https://arxiv.org/search/?query=Yitang+Zhang+Bound+on+Prime+Gaps&searchtype=title
Math,The Polymath Project on Prime Gaps,https://arxiv.org/abs/1407.4890
Math,The ABC Conjecture and Inter-universal Teichmuller Theory,https://arxiv.org/search/?query=ABC+Conjecture+and+Inter-universal+Teichmuller+Theory&searchtype=title
Math,Mochizuki's Proof of the ABC Conjecture,https://arxiv.org/search/?query=Mochizuki+Proof+of+the+ABC+Conjecture&searchtype=title
Math,The PCP Theorem,https://arxiv.org/search/?query=The+PCP+Theorem&searchtype=title
Math,The Unique Games Conjecture,https://arxiv.org/abs/0805.2323
Math,Ramanujan Graphs,https://arxiv.org/search/?query=Ramanujan+Graphs&searchtype=title
Math,The Katz-Sarnak Philosophy for L-functions,https://arxiv.org/search/?query=Katz-Sarnak+Philosophy+for+L-functions&searchtype=title
Math,Random Matrix Theory and the Riemann Zeta Function,https://arxiv.org/abs/math/0008044
Math,The Montgomery-Odlyzko Law,https://arxiv.org/search/?query=Montgomery-Odlyzko+Law&searchtype=title
Math,The Tracy-Widom Distribution,https://arxiv.org/search/?query=Tracy-Widom+Distribution&searchtype=title
Math,The Kardar-Parisi-Zhang Universality Class,https://arxiv.org/abs/1207.6905
Math,The KPZ Equation,https://arxiv.org/search/?query=The+KPZ+Equation&searchtype=title
Math,Stochastic Partial Differential Equations,https://arxiv.org/search/?query=Stochastic+Partial+Differential+Equations&searchtype=title
Math,Regularity Structures for SPDEs,https://arxiv.org/abs/1303.5113
Math,Martin Hairer's work on SPDEs,https://arxiv.org/search/?query=Martin+Hairer+SPDEs&searchtype=title
Math,The Schramm-Loewner Evolution (SLE),https://arxiv.org/abs/math/9904022
Math,Conformal Invariance of the critical percolation cluster,https://arxiv.org/search/?query=Conformal+Invariance+of+the+critical+percolation+cluster&searchtype=title
Math,The Gaussian Free Field,https://arxiv.org/search/?query=The+Gaussian+Free+Field&searchtype=title
Math,Liouville Quantum Gravity,https://arxiv.org/search/?query=Liouville+Quantum+Gravity&searchtype=title
Math,The Brownian Map,https://arxiv.org/abs/1105.3258
Math,The resolution of the Cap Set Problem,https://arxiv.org/abs/1605.09223
Math,The Polynomial Method in Combinatorics,https://arxiv.org/search/?query=The+Polynomial+Method+in+Combinatorics&searchtype=title
Math,The Kakeya Conjecture,https://arxiv.org/search/?query=The+Kakeya+Conjecture&searchtype=title
Math,The Restriction Conjecture in Harmonic Analysis,https://arxiv.org/search/?query=Restriction+Conjecture+Harmonic+Analysis&searchtype=title
Math,The Decoupling Theorem,https://arxiv.org/abs/1405.3567
Math,The Bochner-Riesz Conjecture,https://arxiv.org/search/?query=The+Bochner-Riesz+Conjecture&searchtype=title
Math,The Invariant Subspace Problem,https://arxiv.org/search/?query=The+Invariant+Subspace+Problem&searchtype=title
Math,The Connes Embedding Problem,https://arxiv.org/search/?query=The+Connes+Embedding+Problem&searchtype=title
Math,MIP*=RE: A resolution of the Connes Embedding Problem,https://arxiv.org/abs/2001.04383
Math,Tsirelson's Problem in Quantum Information Theory,https://arxiv.org/search/?query=Tsirelson+Problem+Quantum+Information+Theory&searchtype=title
Math,The Sensitivity Conjecture,https://arxiv.org/abs/1907.00847
Math,The Sunflower Lemma Bounds,https://arxiv.org/abs/1908.09327
Math,The Delta-System Lemma,https://arxiv.org/search/?query=The+Delta-System+Lemma&searchtype=title
Math,The Erdos-Rado Theorem,https://arxiv.org/search/?query=The+Erdos-Rado+Theorem&searchtype=title
Math,Ramsey Theory on Graphs,https://arxiv.org/search/?query=Ramsey+Theory+on+Graphs&searchtype=title
Math,The Continuum Hypothesis,https://arxiv.org/search/?query=The+Continuum+Hypothesis&searchtype=title
Math,Large Cardinals in Set Theory,https://arxiv.org/search/?query=Large+Cardinals+in+Set+Theory&searchtype=title
Math,Projective Determinacy,https://arxiv.org/search/?query=Projective+Determinacy&searchtype=title
Math,The Axiom of Determinacy,https://arxiv.org/search/?query=The+Axiom+of+Determinacy&searchtype=title
Math,Inner Model Theory,https://arxiv.org/search/?query=Inner+Model+Theory&searchtype=title
Math,Core Models in Set Theory,https://arxiv.org/search/?query=Core+Models+Set+Theory&searchtype=title
Math,The Langlands Program,https://arxiv.org/search/?query=The+Langlands+Program&searchtype=title
Math,The Geometric Langlands Program,https://arxiv.org/search/?query=The+Geometric+Langlands+Program&searchtype=title
Physics,The AdS/CFT Correspondence,https://arxiv.org/abs/hep-th/9711200
Physics,The Holographic Principle,https://arxiv.org/abs/hep-th/9409089
Physics,Black Hole Thermodynamics,https://arxiv.org/abs/gr-qc/9712019
Physics,Hawking Radiation,https://arxiv.org/search/?query=Hawking+Radiation&searchtype=title
Physics,Black Hole Entropy,https://arxiv.org/search/?query=Black+Hole+Entropy&searchtype=title
Physics,The Black Hole Information Paradox,https://arxiv.org/search/?query=The+Black+Hole+Information+Paradox&searchtype=title
Physics,The Firewall Paradox for Black Holes,https://arxiv.org/abs/1207.3123
Physics,Complementarity in Quantum Gravity,https://arxiv.org/search/?query=Complementarity+in+Quantum+Gravity&searchtype=title
Physics,String Theory Foundations,https://arxiv.org/search/?query=String+Theory+Foundations&searchtype=title
Physics,M-Theory and Matrix Models,https://arxiv.org/abs/hep-th/9610043
Physics,D-Branes in String Theory,https://arxiv.org/search/?query=D-Branes+in+String+Theory&searchtype=title
Physics,T-Duality in String Theory,https://arxiv.org/search/?query=T-Duality+String+Theory&searchtype=title
Physics,S-Duality in String Theory,https://arxiv.org/search/?query=S-Duality+String+Theory&searchtype=title
Physics,Seiberg-Witten Theory,https://arxiv.org/search/?query=Seiberg-Witten+Theory&searchtype=title
Physics,The Standard Model of Particle Physics,https://arxiv.org/search/?query=The+Standard+Model+of+Particle+Physics&searchtype=title
Physics,The Discovery of the Higgs Boson,https://arxiv.org/abs/1207.7214
Physics,The Higgs Mechanism,https://arxiv.org/search/?query=The+Higgs+Mechanism&searchtype=title
Physics,Supersymmetry and the MSSM,https://arxiv.org/search/?query=Supersymmetry+and+the+MSSM&searchtype=title
Physics,The Strong CP Problem,https://arxiv.org/search/?query=The+Strong+CP+Problem&searchtype=title
Physics,Axions and Dark Matter,https://arxiv.org/search/?query=Axions+and+Dark+Matter&searchtype=title
Physics,WIMPs and Dark Matter Candidates,https://arxiv.org/search/?query=WIMPs+and+Dark+Matter+Candidates&searchtype=title
Physics,Direct Detection of Dark Matter,https://arxiv.org/search/?query=Direct+Detection+of+Dark+Matter&searchtype=title
Physics,Indirect Detection of Dark Matter,https://arxiv.org/search/?query=Indirect+Detection+of+Dark+Matter&searchtype=title
Physics,Neutrino Oscillations,https://arxiv.org/abs/hep-ex/9807003
Physics,The MSW Effect for Solar Neutrinos,https://arxiv.org/search/?query=The+MSW+Effect+for+Solar+Neutrinos&searchtype=title
Physics,The Daya Bay Reactor Neutrino Experiment,https://arxiv.org/search/?query=Daya+Bay+Reactor+Neutrino+Experiment&searchtype=title
Physics,The SNO Solar Neutrino Results,https://arxiv.org/search/?query=The+SNO+Solar+Neutrino+Results&searchtype=title
Physics,Cosmic Microwave Background Radiation,https://arxiv.org/search/?query=Cosmic+Microwave+Background+Radiation&searchtype=title
Physics,The WMAP Results on the CMB,https://arxiv.org/search/?query=WMAP+Results+CMB&searchtype=title
Physics,The Planck Results on the CMB,https://arxiv.org/abs/1807.06209
Physics,COBE Results and the Anisotropy of the CMB,https://arxiv.org/search/?query=COBE+Results+Anisotropy+CMB&searchtype=title
Physics,B-Mode Polarization of the CMB,https://arxiv.org/search/?query=B-Mode+Polarization+CMB&searchtype=title
Physics,Cosmic Inflation,https://arxiv.org/search/?query=Cosmic+Inflation&searchtype=title
Physics,Slow-Roll Inflation,https://arxiv.org/search/?query=Slow-Roll+Inflation&searchtype=title
Physics,Chaotic Inflation,https://arxiv.org/search/?query=Chaotic+Inflation&searchtype=title
Physics,Eternal Inflation,https://arxiv.org/search/?query=Eternal+Inflation&searchtype=title
Physics,The Multiverse Hypothesis,https://arxiv.org/search/?query=The+Multiverse+Hypothesis&searchtype=title
