Domain,Title,Link
Physics,The Accelerating Universe and Dark Energy,https://arxiv.org/abs/astro-ph/9812133
Physics,The Cosmological Constant Problem,https://arxiv.org/abs/astro-ph/0603057
Physics,Quintessence and Dark Energy,https://arxiv.org/search/?query=Quintessence+and+Dark+Energy&searchtype=title
Physics,Modified Gravity Theories,https://arxiv.org/search/?query=Modified+Gravity+Theories&searchtype=title
Physics,f(R) Gravity,https://arxiv.org/abs/0805.1726
Physics,Gravitational Waves from Binary Black Holes,https://arxiv.org/abs/1602.03837
Physics,Gravitational Waves from Binary Neutron Stars,https://arxiv.org/abs/1710.05832
Physics,Multi-Messenger Astronomy with Gravitational Waves,https://arxiv.org/abs/1710.05833
Physics,The Stochastic Gravitational Wave Background,https://arxiv.org/search/?query=The+Stochastic+Gravitational+Wave+Background&searchtype=title
Physics,Pulsar Timing Arrays and Gravitational Waves,https://arxiv.org/abs/2306.16213
Physics,The First Image of a Black Hole,https://arxiv.org/abs/1906.11238
Physics,The Event Horizon Telescope,https://arxiv.org/search/?query=The+Event+Horizon+Telescope&searchtype=title
Physics,Supermassive Black Holes at the Center of Galaxies,https://arxiv.org/search/?query=Supermassive+Black+Holes+at+Center+of+Galaxies&searchtype=title
Physics,Active Galactic Nuclei and Quasars,https://arxiv.org/search/?query=Active+Galactic+Nuclei+Quasars&searchtype=title
Physics,The Formation of Galaxies,https://arxiv.org/search/?query=The+Formation+of+Galaxies&searchtype=title
Physics,Cold Dark Matter Structure Formation,https://arxiv.org/search/?query=Cold+Dark+Matter+Structure+Formation&searchtype=title
Physics,The Hubble Tension,https://arxiv.org/abs/1908.03663
Physics,The S8 Tension in Cosmology,https://arxiv.org/search/?query=The+S8+Tension+in+Cosmology&searchtype=title
Physics,Fast Radio Bursts,https://arxiv.org/abs/1307.1628
Physics,Gamma-Ray Bursts and their Origins,https://arxiv.org/search/?query=Gamma-Ray+Bursts+and+their+Origins&searchtype=title
Physics,Exoplanet Discoveries with Kepler,https://arxiv.org/search/?query=Exoplanet+Discoveries+with+Kepler&searchtype=title
Physics,The TRAPPIST-1 Exoplanet System,https://arxiv.org/abs/1703.01424
Physics,Biosignatures in Exoplanet Atmospheres,https://arxiv.org/search/?query=Biosignatures+Exoplanet+Atmospheres&searchtype=title
Physics,Topological Insulators in 2D and 3D,https://arxiv.org/abs/1008.2026
Physics,The Quantum Spin Hall Effect,https://arxiv.org/abs/cond-mat/0611341
Physics,Fractional Quantum Hall Effect,https://arxiv.org/search/?query=Fractional+Quantum+Hall+Effect&searchtype=title
Physics,Integer Quantum Hall Effect,https://arxiv.org/search/?query=Integer+Quantum+Hall+Effect&searchtype=title
Physics,Graphene and its Electronic Properties,https://arxiv.org/abs/0902.3208
Physics,Magic-Angle Twisted Bilayer Graphene,https://arxiv.org/abs/1803.02342
Physics,Superconductivity in Twisted Bilayer Graphene,https://arxiv.org/abs/1803.02342
Physics,High-Temperature Superconductivity in Cuprates,https://arxiv.org/search/?query=High-Temperature+Superconductivity+in+Cuprates&searchtype=title
Physics,Iron-Based Superconductors,https://arxiv.org/abs/0804.4815
Physics,BCS Theory of Superconductivity,https://arxiv.org/search/?query=BCS+Theory+of+Superconductivity&searchtype=title
Physics,Majorana Fermions in Condensed Matter Physics,https://arxiv.org/abs/1206.1736
Physics,Topological Quantum Computation,https://arxiv.org/abs/quant-ph/0205206
Physics,Anyons in Fractional Quantum Hall States,https://arxiv.org/search/?query=Anyons+Fractional+Quantum+Hall+States&searchtype=title
Physics,Weyl Semimetals,https://arxiv.org/abs/1502.04684
Physics,Dirac Semimetals,https://arxiv.org/search/?query=Dirac+Semimetals&searchtype=title
Physics,Quantum Spin Liquids,https://arxiv.org/abs/cond-mat/0612446
Physics,The Kitaev Honeycomb Model,https://arxiv.org/abs/cond-mat/0506438
Physics,Quantum Entanglement and Bell Inequalities,https://arxiv.org/abs/quant-ph/0402001
Physics,Quantum Teleportation Experiments,https://arxiv.org/abs/quant-ph/9702052
Physics,Quantum Key Distribution Algorithms,https://arxiv.org/search/?query=Quantum+Key+Distribution+Algorithms&searchtype=title
Physics,Peter Shor's Factoring Algorithm,https://arxiv.org/abs/quant-ph/9508027
Physics,Lov Grover's Search Algorithm,https://arxiv.org/abs/quant-ph/9605043
Physics,Quantum Supremacy on a Programmable Processor,https://arxiv.org/abs/1910.11333
Physics,Surface Codes for Quantum Error Correction,https://arxiv.org/abs/1208.0928
Physics,Fault-Tolerant Quantum Computation,https://arxiv.org/search/?query=Fault-Tolerant+Quantum+Computation&searchtype=title
Physics,Variational Quantum Eigensolver,https://arxiv.org/abs/1304.3061
Physics,Quantum Approximate Optimization Algorithm,https://arxiv.org/abs/1411.4028
Physics,Boson Sampling with Linear Optics,https://arxiv.org/abs/1011.3245
Physics,Time Crystals in Quantum Systems,https://arxiv.org/abs/1610.08057
Physics,Many-Body Localization,https://arxiv.org/abs/1404.0686
Physics,The Eigenstate Thermalization Hypothesis,https://arxiv.org/abs/cond-mat/9403051
Physics,Quantum Chaos and OTOCs,https://arxiv.org/abs/1503.01409
Physics,The Sachdev-Ye-Kitaev Model,https://arxiv.org/abs/1604.07818
Physics,Fluid-Gravity Correspondence,https://arxiv.org/abs/0712.2456
Physics,Viscosity Bound in String Theory,https://arxiv.org/abs/hep-th/0405231
Physics,Quark-Gluon Plasma and the RHIC Results,https://arxiv.org/search/?query=Quark-Gluon+Plasma+RHIC&searchtype=title
Physics,CERN LHC Results on Quark-Gluon Plasma,https://arxiv.org/search/?query=CERN+LHC+Quark-Gluon+Plasma&searchtype=title
Physics,Lattice QCD Calculations of the Hadron Spectrum,https://arxiv.org/search/?query=Lattice+QCD+Hadron+Spectrum&searchtype=title
Physics,Chiral Perturbation Theory,https://arxiv.org/search/?query=Chiral+Perturbation+Theory&searchtype=title
Physics,The Parton Model and Deep Inelastic Scattering,https://arxiv.org/search/?query=Parton+Model+Deep+Inelastic+Scattering&searchtype=title
Physics,Asymptotic Freedom in QCD,https://arxiv.org/search/?query=Asymptotic+Freedom+in+QCD&searchtype=title
Physics,Quantum Electrodynamics Renormalization,https://arxiv.org/search/?query=Quantum+Electrodynamics+Renormalization&searchtype=title
Physics,The Casimir Effect,https://arxiv.org/search/?query=Casimir+Effect&searchtype=title
Physics,Anderson Localization,https://arxiv.org/search/?query=Anderson+Localization&searchtype=title
Physics,The Quantum Hall Effect,https://arxiv.org/search/?query=Quantum+Hall+Effect&searchtype=title
Physics,Bose-Einstein Condensation in Dilute Gases,https://arxiv.org/abs/cond-mat/9612053
Physics,Feshbach Resonances in Ultracold Gases,https://arxiv.org/search/?query=Feshbach+Resonances+Ultracold+Gases&searchtype=title
Physics,Optical Lattices and Quantum Simulation,https://arxiv.org/search/?query=Optical+Lattices+Quantum+Simulation&searchtype=title
Physics,Rydberg Atoms for Quantum Information,https://arxiv.org/search/?query=Rydberg+Atoms+Quantum+Information&searchtype=title
Physics,Cavity Quantum Electrodynamics,https://arxiv.org/search/?query=Cavity+Quantum+Electrodynamics&searchtype=title
Physics,Circuit Quantum Electrodynamics,https://arxiv.org/search/?query=Circuit+Quantum+Electrodynamics&searchtype=title
Physics,The Transmon Qubit,https://arxiv.org/search/?query=The+Transmon+Qubit&searchtype=title
Physics,Flux Qubits,https://arxiv.org/search/?query=Flux+Qubits&searchtype=title
Physics,Phase Qubits,https://arxiv.org/search/?query=Phase+Qubits&searchtype=title
Physics,Topological Qubits,https://arxiv.org/search/?query=Topological+Qubits&searchtype=title
Bio,CRISPR-Cas9 gene editing technology,https://arxiv.org/search/?query=CRISPR-Cas9+gene+editing&searchtype=title
Bio,Base editing: precision genetic alterations,https://arxiv.org/search/?query=Base+editing+precision+genetic&searchtype=title
Bio,Prime editing: search and replace DNA,https://arxiv.org/search/?query=Prime+editing+DNA&searchtype=title
Bio,AlphaFold: High accuracy protein structure prediction,https://arxiv.org/abs/2107.03374
Bio,RoseTTAFold for protein interaction,https://arxiv.org/abs/2107.05047
Bio,Single-cell RNA sequencing methodology,https://arxiv.org/search/?query=Single-cell+RNA+sequencing+methodology&searchtype=title
Bio,Spatial transcriptomics techniques,https://arxiv.org/search/?query=Spatial+transcriptomics&searchtype=title
Bio,Deep learning for predicting protein-protein interactions,https://arxiv.org/abs/2111.02815
Bio,Machine learning in precision medicine,https://arxiv.org/search/?query=Machine+learning+in+precision+medicine&searchtype=title
Bio,DeepBind: Predicting sequence specificities,https://arxiv.org/abs/1508.01259
Bio,DeepSEA: Noncoding variants with deep learning,https://arxiv.org/abs/1508.01259
Bio,Antibiotic discovery using deep learning,https://arxiv.org/search/?query=Antibiotic+discovery+using+deep+learning&searchtype=title
Bio,ESMFold: Evolutionary Scale Modeling,https://arxiv.org/abs/2207.14255
Bio,DeepVariant for highly accurate genome sequencing,https://arxiv.org/search/?query=DeepVariant+Highly+accurate+genome+sequencing&searchtype=title
Bio,AlphaMissense for variant effects,https://arxiv.org/search/?query=AlphaMissense&searchtype=title
Bio,Language models for biological sequence,https://arxiv.org/abs/2103.00020
Bio,Decoding motor cortex signals with RNNs,https://arxiv.org/abs/1602.04938
Bio,Molecular geometry prediction using graph neural nets,https://arxiv.org/abs/1806.07366
Bio,AlphaFold3: Interactions of protein RNA DNA,https://arxiv.org/search/?query=AlphaFold3&searchtype=title
Bio,Unsupervised learning of evolutionary landscapes,https://arxiv.org/abs/2101.08331
Bio,Unified language models for biological sequences,https://arxiv.org/search/?query=Unified+language+models+biological+sequences&searchtype=title
Bio,Semantic reconstruction of continuous language,https://arxiv.org/search/?query=Semantic+reconstruction+continuous+language&searchtype=title
Bio,scVI: Deep generative modeling for transcriptomics,https://arxiv.org/abs/1709.02082
Bio,Predicting the effects of missense variants,https://arxiv.org/abs/2309.03577
Bio,Predicting off-target effects of CRISPR via deep learning,https://arxiv.org/abs/1806.00224
Bio,Federated learning for healthcare data,https://arxiv.org/abs/2108.08398
Bio,BioBERT: a pre-trained biomedical language representation,https://arxiv.org/abs/1901.08746
Bio,PubMedBERT: Domain-Specific Language Model Pretraining,https://arxiv.org/abs/2007.15779
Bio,Unified approach for single-cell spatial transcriptomics,https://arxiv.org/search/?query=Unified+approach+for+single-cell+spatial+transcriptomics&searchtype=title
Bio,Decoding Neural Networks for Brain-Computer Interfaces,https://arxiv.org/search/?query=Decoding+Neural+Networks+for+Brain-Computer+Interfaces&searchtype=title
Bio,High-throughput functional genomics via machine learning,https://arxiv.org/search/?query=High-throughput+functional+genomics+via+machine+learning&searchtype=title
Bio,Deep learning on human genetic variation,https://arxiv.org/search/?query=Deep+learning+on+human+genetic+variation&searchtype=title
Bio,Predicting long non-coding RNA functions,https://arxiv.org/search/?query=Predicting+long+non-coding+RNA+functions&searchtype=title
Bio,Structural biology in the era of AlphaFold,https://arxiv.org/search/?query=Structural+biology+in+the+era+of+AlphaFold&searchtype=title
Bio,Generative models for DNA sequences,https://arxiv.org/search/?query=Generative+models+for+DNA+sequences&searchtype=title
Bio,Deciphering the regulatory code of the human genome,https://arxiv.org/search/?query=Deciphering+the+regulatory+code+of+the+human+genome&searchtype=title
Bio,Machine learning of cellular responses to perturbations,https://arxiv.org/search/?query=Machine+learning+of+cellular+responses+to+perturbations&searchtype=title
Bio,Integrative modeling of macromolecular assemblies,https://arxiv.org/search/?query=Integrative+modeling+of+macromolecular+assemblies&searchtype=title
Bio,Deep learning for highly multiplexed tissue imaging,https://arxiv.org/search/?query=Deep+learning+for+highly+multiplexed+tissue+imaging&searchtype=title
Bio,Computational systems biology of cancer,https://arxiv.org/search/?query=Computational+systems+biology+of+cancer&searchtype=title
Bio,Deep learning approaches to genome editing optimization,https://arxiv.org/search/?query=Deep+learning+approaches+to+genome+editing+optimization&searchtype=title
Bio,Predicting protein structures from multiple sequence alignments,https://arxiv.org/search/?query=Predicting+protein+structures+from+multiple+sequence+alignments&searchtype=title
Bio,Machine learning for single-cell epigenomics,https://arxiv.org/search/?query=Machine+learning+for+single-cell+epigenomics&searchtype=title
Bio,Modeling RNA structure with deep learning,https://arxiv.org/search/?query=Modeling+RNA+structure+with+deep+learning&searchtype=title
Bio,Deep generative design of antibodies,https://arxiv.org/search/?query=Deep+generative+design+of+antibodies&searchtype=title
Bio,AI in computational pathology,https://arxiv.org/search/?query=AI+in+computational+pathology&searchtype=title
Bio,Machine learning for infectious disease outbreaks,https://arxiv.org/search/?query=Machine+learning+for+infectious+disease+outbreaks&searchtype=title
Bio,Deep learning of protein conformational ensembles,https://arxiv.org/search/?query=Deep+learning+of+protein+conformational+ensembles&searchtype=title
Bio,Language models for regulatory genomics,https://arxiv.org/search/?query=Language+models+for+regulatory+genomics&searchtype=title
Bio,Automated analysis of biological pathways using AI,https://arxiv.org/search/?query=Automated+analysis+of+biological+pathways+using+AI&searchtype=title
Bio,AI-driven optimization of synthetic biological circuits,https://arxiv.org/search/?query=AI-driven+optimization+of+synthetic+biological+circuits&searchtype=title
Bio,Machine learning for multi-omics biomarker discovery,https://arxiv.org/search/?query=Machine+learning+for+multi-omics+biomarker+discovery&searchtype=title
Bio,Predicting drug toxicity via deep learning,https://arxiv.org/search/?query=Predicting+drug+toxicity+via+deep+learning&searchtype=title
Bio,Graph neural networks for modeling biological networks,https://arxiv.org/search/?query=Graph+neural+networks+for+modeling+biological+networks&searchtype=title
Bio,Deep learning for quantitative phenotype prediction,https://arxiv.org/search/?query=Deep+learning+for+quantitative+phenotype+prediction&searchtype=title
Bio,AI for the analysis of spatial transcriptomics,https://arxiv.org/search/?query=AI+for+the+analysis+of+spatial+transcriptomics&searchtype=title
Bio,Deep learning models of cellular differentiation,https://arxiv.org/search/?query=Deep+learning+models+of+cellular+differentiation&searchtype=title
Bio,Machine learning in microbiome data analysis,https://arxiv.org/search/?query=Machine+learning+in+microbiome+data+analysis&searchtype=title
Bio,Deep learning for predicting protein-ligand interactions,https://arxiv.org/search/?query=Deep+learning+for+predicting+protein-ligand+interactions&searchtype=title
Bio,Generative AI for small molecule drug discovery,https://arxiv.org/search/?query=Generative+AI+for+small+molecule+drug+discovery&searchtype=title
Bio,AI-assisted proteomics data interpretation,https://arxiv.org/search/?query=AI-assisted+proteomics+data+interpretation&searchtype=title
Bio,Machine learning for detecting actionable mutations,https://arxiv.org/search/?query=Machine+learning+for+detecting+actionable+mutations&searchtype=title
Bio,Deep learning of chromatin accessibility,https://arxiv.org/search/?query=Deep+learning+of+chromatin+accessibility&searchtype=title
Bio,Predicting transcription factor binding sites via CNNs,https://arxiv.org/search/?query=Predicting+transcription+factor+binding+sites+via+CNNs&searchtype=title
Bio,Deep learning for interpreting untargeted metabolomics,https://arxiv.org/search/?query=Deep+learning+for+interpreting+untargeted+metabolomics&searchtype=title
Bio,AI models for personalized medicine,https://arxiv.org/search/?query=AI+models+for+personalized+medicine&searchtype=title
Bio,Translating sequences into protein structures,https://arxiv.org/search/?query=Translating+sequences+into+protein+structures&searchtype=title
Bio,Generative modeling of biological sequence space,https://arxiv.org/search/?query=Generative+modeling+of+biological+sequence+space&searchtype=title
Bio,Self-assembling protein nanomaterials via computational design,https://arxiv.org/search/?query=Self-assembling+protein+nanomaterials+via+computational+design&searchtype=title
Bio,Deep learning architectures for bioinformatics,https://arxiv.org/search/?query=Deep+learning+architectures+for+bioinformatics&searchtype=title
Bio,Reinforcement learning for protein folding,https://arxiv.org/search/?query=Reinforcement+learning+for+protein+folding&searchtype=title
Bio,Machine learning predicts drug resistance,https://arxiv.org/search/?query=Machine+learning+predicts+drug+resistance&searchtype=title
Bio,Deep sequence models for protein family expansion,https://arxiv.org/search/?query=Deep+sequence+models+for+protein+family+expansion&searchtype=title
Bio,Transformers in computational biology,https://arxiv.org/search/?query=Transformers+in+computational+biology&searchtype=title
Bio,Language-model based prediction of mutation effects,https://arxiv.org/search/?query=Language-model+based+prediction+of+mutation+effects&searchtype=title
Bio,End-to-end biological structure prediction with AI,https://arxiv.org/search/?query=End-to-end+biological+structure+prediction+con+AI&searchtype=title
Bio,Deep learning for systems pharmacology,https://arxiv.org/search/?query=Deep+learning+for+systems+pharmacology&searchtype=title
Bio,Generative models of complex biomolecular machines,https://arxiv.org/search/?query=Generative+models+of+complex+biomolecular+machines&searchtype=title
Bio,Deep learning directed evolution of enzymes,https://arxiv.org/search/?query=Deep+learning+directed+evolution+of+enzymes&searchtype=title
Bio,Artificial intelligence enables structural mapping of the human proteome,https://arxiv.org/search/?query=Artificial+intelligence+enables+structural+mapping+of+the+human+proteome&searchtype=title
Bio,Deep models unlock evolutionary conservation,https://arxiv.org/search/?query=Deep+models+unlock+evolutionary+conservation&searchtype=title
Bio,Predicting 3D genome organization with AI,https://arxiv.org/search/?query=Predicting+3D+genome+organization+with+AI&searchtype=title
Bio,Interpretable deep learning in biosciences,https://arxiv.org/search/?query=Interpretable+deep+learning+in+biosciences&searchtype=title
Bio,Predicting post-translational modifications,https://arxiv.org/search/?query=Predicting+post-translational+modifications&searchtype=title
Bio,Machine learning analysis of microbiome interactions,https://arxiv.org/search/?query=Machine+learning+analysis+of+microbiome+interactions&searchtype=title
Bio,Sequence-based prediction of protein aggregation,https://arxiv.org/search/?query=Sequence-based+prediction+of+protein+aggregation&searchtype=title
Bio,AI for automated experimental biology,https://arxiv.org/search/?query=AI+for+automated+experimental+biology&searchtype=title
Bio,AI synthesis of biomedical research hypotheses,https://arxiv.org/search/?query=AI+synthesis+of+biomedical+research+hypotheses&searchtype=title
Bio,Deep learning of RNA-protein interactions,https://arxiv.org/search/?query=Deep+learning+of+RNA-protein+interactions&searchtype=title
Bio,Network analysis of disease modules with graph models,https://arxiv.org/search/?query=Network+analysis+of+disease+modules+with+graph+models&searchtype=title
Bio,AI-driven systems medicine,https://arxiv.org/search/?query=AI-driven+systems+medicine&searchtype=title
Bio,Deep models of epigenetic regulation,https://arxiv.org/search/?query=Deep+models+of+epigenetic+regulation&searchtype=title
Bio,Automated extraction of chemical-protein relations,https://arxiv.org/search/?query=Automated+extraction+of+chemical-protein+relations&searchtype=title
Bio,Transformers for extracting genomic relations,https://arxiv.org/search/?query=Transformers+for+extracting+genomic+relations&searchtype=title
Bio,Knowledge graphs for multi-target drug discovery,https://arxiv.org/search/?query=Knowledge+graphs+for+multi-target+drug+discovery&searchtype=title
Bio,Predicting off-target interactions of new therapeutics,https://arxiv.org/search/?query=Predicting+off-target+interactions+of+new+therapeutics&searchtype=title
Bio,Deep learning decodes the biology of aging,https://arxiv.org/search/?query=Deep+learning+decodes+the+biology+of+aging&searchtype=title
Bio,AI models of neurodegeneration,https://arxiv.org/search/?query=AI+models+of+neurodegeneration&searchtype=title
Bio,Generative models for novel protein design,https://arxiv.org/search/?query=Generative+models+for+novel+protein+design&searchtype=title
Bio,Self-supervised learning on genomic sequencing data,https://arxiv.org/search/?query=Self-supervised+learning+on+genomic+sequencing+data&searchtype=title
Bio,AI characterizes unannotated protein structures,https://arxiv.org/search/?query=AI+characterizes+unannotated+protein+structures&searchtype=title
Bio,Deep learning reveals complex trait heritability,https://arxiv.org/search/?query=Deep+learning+reveals+complex+trait+heritability&searchtype=title
Bio,Machine learning of cellular signal transduction,https://arxiv.org/search/?query=Machine+learning+of+cellular+signal+transduction&searchtype=title
Bio,Integrative AI modeling of human physiology,https://arxiv.org/search/?query=Integrative+AI+modeling+of+human+physiology&searchtype=title
Bio,Spatial genomics analysis via deep learning architectures,https://arxiv.org/search/?query=Spatial+genomics+analysis+via+deep+learning+architectures&searchtype=title
Bio,AI identifies rare disease causal variants,https://arxiv.org/search/?query=AI+identifies+rare+disease+causal+variants&searchtype=title
Physics,Kibble-Zurek Mechanism Theory,https://arxiv.org/search/?query=Kibble-Zurek+Mechanism+Theory&searchtype=title
Physics,Shor's Algorithm Experimental Verifications,https://arxiv.org/search/?query=Shor+Algorithm+Experimental+Verifications&searchtype=title
Physics,Topological Orders and Edge Excitations formulation,https://arxiv.org/search/?query=Topological+Orders+and+Edge+Excitations+formulation&searchtype=title
Bio,Deep learning approaches to predicting enhancer-promoter interactions,https://arxiv.org/search/?query=Deep+learning+approaches+predicting+enhancer-promoter&searchtype=title
Bio,Generative models for DNA sequence design with neural networks,https://arxiv.org/search/?query=Generative+models+for+DNA+sequence+design+neural+networks&searchtype=title
Bio,Predictable genome engineering and structural manipulation using CRISPR,https://arxiv.org/search/?query=Predictable+genome+engineering+structural+manipulation+CRISPR&searchtype=title
CS,Transformer-XL: Attentive Language Models Beyond a Fixed-Length Context architectures,https://arxiv.org/abs/1901.02860
CS,Sparse Transformers for Long Contexts,https://arxiv.org/search/?query=Sparse+Transformers+for+Long+Contexts&searchtype=title
CS,Reformer: The Efficient Transformer architecture,https://arxiv.org/abs/2001.04451
CS,Longformer: The Long-Document Transformer mechanism,https://arxiv.org/abs/2004.05150
CS,Linformer: Self-Attention with Linear Complexity scaling,https://arxiv.org/abs/2006.04768
CS,Perceiver: General Perception with Iterative Attention methodology,https://arxiv.org/abs/2103.03206
CS,Perceiver IO: A General Architecture for Structured Inputs and Outputs,https://arxiv.org/abs/2107.14795
CS,A ConvNet for the 2020s paradigm,https://arxiv.org/abs/2201.03545
CS,MLP-Mixer: An all-MLP Architecture for Vision recognition,https://arxiv.org/abs/2105.01601
CS,Masked Autoencoders Are Scalable Vision Learners approach,https://arxiv.org/abs/2111.06377
CS,MoCo: Momentum Contrast for Unsupervised Visual Representation Learning system,https://arxiv.org/abs/1911.05722
CS,SimCLR: A Simple Framework for Contrastive Learning of Visual Representations analysis,https://arxiv.org/abs/2002.05709
CS,BYOL: Bootstrap Your Own Latent A New Approach to Self-Supervised Learning method,https://arxiv.org/abs/2006.07733
Math,Grothendieck's resolution of singularities,https://arxiv.org/search/?query=Grothendieck+resolution+of+singularities&searchtype=title
Math,Fermat's little theorem generalisations,https://arxiv.org/search/?query=Fermat+little+theorem+generalisations&searchtype=title
Math,Ramanujan's master theorem,https://arxiv.org/search/?query=Ramanujan+master+theorem&searchtype=title
Math,Euler's formula for complex analysis,https://arxiv.org/search/?query=Euler+formula+for+complex+analysis&searchtype=title
Math,Cantor's diagonal argument,https://arxiv.org/search/?query=Cantor+diagonal+argument&searchtype=title
Math,Godel's incompleteness theorems derivations,https://arxiv.org/search/?query=Godel+incompleteness&searchtype=title
Math,Cohen's forcing in set theory,https://arxiv.org/search/?query=Cohen+forcing+in+set+theory&searchtype=title
Math,Zermelo-Fraenkel set theory axioms,https://arxiv.org/search/?query=Zermelo-Fraenkel+set+theory+axioms&searchtype=title
Bio,Transcriptional regulation mechanisms in eukaryotic cells,https://arxiv.org/search/?query=Transcriptional+regulation+mechanisms+in+eukaryotic+cells&searchtype=title
Bio,Epigenetic inheritance and chromatin mechanisms,https://arxiv.org/search/?query=Epigenetic+inheritance+and+chromatin+mechanisms&searchtype=title
Bio,Non-coding RNAs and their roles in gene regulation,https://arxiv.org/search/?query=Non-coding+RNAs+roles+gene+regulation&searchtype=title
Bio,Telomeres and telomerase in aging and cancer,https://arxiv.org/search/?query=Telomeres+and+telomerase+aging+cancer&searchtype=title
