Domain,Title,arXiv_ID
Bio,Machine learning of cellular signal transduction,UNKNOWN
Bio,Integrative AI modeling of human physiology,UNKNOWN
Bio,Spatial genomics analysis via deep learning architectures,UNKNOWN
Bio,AI identifies rare disease causal variants,UNKNOWN
Physics,Kibble-Zurek Mechanism Theory,UNKNOWN
Physics,Shor's Algorithm Experimental Verifications,UNKNOWN
Physics,Topological Orders and Edge Excitations formulation,UNKNOWN
Bio,Deep learning approaches to predicting enhancer-promoter interactions,UNKNOWN
Bio,Generative models for DNA sequence design with neural networks,UNKNOWN
Bio,Predictable genome engineering and structural manipulation using CRISPR,UNKNOWN
