Domain,Title,arXiv_ID
Bio,Machine learning for single-cell epigenomics,UNKNOWN
Bio,Modeling RNA structure with deep learning,UNKNOWN
Bio,Deep generative design of antibodies,UNKNOWN
Bio,AI in computational pathology,UNKNOWN
Bio,Machine learning for infectious disease outbreaks,UNKNOWN
Bio,Deep learning of protein conformational ensembles,UNKNOWN
Bio,Language models for regulatory genomics,UNKNOWN
Bio,Automated analysis of biological pathways using AI,UNKNOWN
Bio,AI-driven optimization of synthetic biological circuits,UNKNOWN
Bio,Machine learning for multi-omics biomarker discovery,UNKNOWN
